"Komentar;Case_Folding;Normalization;Hasil_Stopword"
"TimeStamp Film br br a NCmE a Opening br a NCmE amp t a Peta Suara Sumatera Pilpres dan br a NCmE amp t a Pemecahan Papua menjadi Provinisi br a NCmE amp t a Penunjukan PJ Gubernur dan PJ Walikota Bupati dipilih Presiden br a NCmE amp t a Kewenangan yang dimiliki Jenderal Tito Karnavian br a NCmE amp t a Pelanggaran keputusan MK dalam penunjukan kepala daerah br a NCmE amp t a Relasi PJ Gubernur dengan presiden br a NCmE amp t a Kecenderungan tidak netral PJ Gubernur br a NCmE amp t a Kecenderungan tidak netral PJ Bupati br a NCmE amp t a Kewenangan PJ Kepala aerah melarang kampanye br a NCmE amp t a Kontroversi deklarasi desa bersatu untuk paslon tertentu br a NCmE amp t a Politisasi kasus penyelewengan dana desa br a NCmE amp t a Tekanan kepada kepala desa untuk mendukung paslon tertentu br a NCmE amp t a Fakta bansos jelang pemilu br a NCmE amp t a Gaji ASN Polri dan pensiunan PNS naik di br a NCmE amp t a Pengabaian data kemensos dalam penyaluran bansos br a NCmE amp t a Bansos digunakan sebagai alat politik br a NCmE amp t a Presiden tidak netral br a NCmE amp t a Presiden dan menteri menteri di pihak koalisi br a NCmE amp t a Bawaslu dan KP tidak profesional br a NCmE amp t a ugaan pelanggaran KP br a NCmE amp t a Hubungan putusan Mahkamah Konstitusi dan pelanggaran KP br a NCmE amp t a Ketua KP mendapat peringatan keras berkali kali br a NCmE amp t a Kontroversi putusan Mahkamah Konstitusi br a NCmE amp t a Closing dan kesimpulan ketiga ahli hukum tata negara;timestamp film br br a ncme a opening br a ncme amp t a peta suara sumatera pilpres dan br a ncme amp t a pemecahan papua menjadi provinisi br a ncme amp t a penunjukan pj gubernur dan pj walikota bupati dipilih presiden br a ncme amp t a kewenangan yang dimiliki jenderal tito karnavian br a ncme amp t a pelanggaran keputusan mk dalam penunjukan kepala daerah br a ncme amp t a relasi pj gubernur dengan presiden br a ncme amp t a kecenderungan tidak netral pj gubernur br a ncme amp t a kecenderungan tidak netral pj bupati br a ncme amp t a kewenangan pj kepala aerah melarang kampanye br a ncme amp t a kontroversi deklarasi desa bersatu untuk paslon tertentu br a ncme amp t a politisasi kasus penyelewengan dana desa br a ncme amp t a tekanan kepada kepala desa untuk mendukung paslon tertentu br a ncme amp t a fakta bansos jelang pemilu br a ncme amp t a gaji asn polri dan pensiunan pns naik di br a ncme amp t a pengabaian data kemensos dalam penyaluran bansos br a ncme amp t a bansos digunakan sebagai alat politik br a ncme amp t a presiden tidak netral br a ncme amp t a presiden dan menteri menteri di pihak koalisi br a ncme amp t a bawaslu dan kp tidak profesional br a ncme amp t a ugaan pelanggaran kp br a ncme amp t a hubungan putusan mahkamah konstitusi dan pelanggaran kp br a ncme amp t a ketua kp mendapat peringatan keras berkali kali br a ncme amp t a kontroversi putusan mahkamah konstitusi br a ncme amp t a closing dan kesimpulan ketiga ahli hukum tata negara;timestamp film baru baru a ncme a opening baru a ncme amp t a peta suara sumatera pilpres dan baru a ncme amp t a pemecahan papua menjadi provinisi baru a ncme amp t a penunjukan pj gubernur dan pj walikota bupati dipilih presiden baru a ncme amp t a kewenangan yang dimiliki jenderal tito karnavian baru a ncme amp t a pelanggaran keputusan mk dalam penunjukan kepala daerah baru a ncme amp t a relasi pj gubernur dengan presiden baru a ncme amp t a kecenderungan tidak netral pj gubernur baru a ncme amp t a kecenderungan tidak netral pj bupati baru a ncme amp t a kewenangan pj kepala aerah melarang kampanye baru a ncme amp t a kontroversi deklarasi desa bersatu untuk paslon tertentu baru a ncme amp t a politisasi kasus penyelewengan dana desa baru a ncme amp t a tekanan kepada kepala desa untuk mendukung paslon tertentu baru a ncme amp t a fakta bansos jelang pemilu baru a ncme amp t a gaji asn polri dan pensiunan pns naik di baru a ncme amp t a pengabaian data kemensos dalam penyaluran bansos baru a ncme amp t a bansos digunakan sebagai alat politik baru a ncme amp t a presiden tidak netral baru a ncme amp t a presiden dan menteri menteri di pihak koalisi baru a ncme amp t a bawaslu dan kp tidak profesional baru a ncme amp t a ugaan pelanggaran kp baru a ncme amp t a hubungan putusan mahkamah konstitusi dan pelanggaran kp baru a ncme amp t a ketua kp mendapat peringatan keras berkali kali baru a ncme amp t a kontroversi putusan mahkamah konstitusi baru a ncme amp t a closing dan kesimpulan ketiga ahli hukum tata negara;timestamp film baru baru a ncme a opening baru a ncme amp t a peta suara sumatera pilpres baru a ncme amp t a pemecahan papua menjadi provinisi baru a ncme amp t a penunjukan pj gubernur pj walikota bupati dipilih presiden baru a ncme amp t a kewenangan dimiliki jenderal tito karnavian baru a ncme amp t a pelanggaran keputusan mk penunjukan kepala daerah baru a ncme amp t a relasi pj gubernur presiden baru a ncme amp t a kecenderungan netral pj gubernur baru a ncme amp t a kecenderungan netral pj bupati baru a ncme amp t a kewenangan pj kepala aerah melarang kampanye baru a ncme amp t a kontroversi deklarasi desa bersatu paslon tertentu baru a ncme amp t a politisasi kasus penyelewengan dana desa baru a ncme amp t a tekanan kepala desa mendukung paslon tertentu baru a ncme amp t a fakta bansos jelang pemilu baru a ncme amp t a gaji asn polri pensiunan pns naik baru a ncme amp t a pengabaian data kemensos penyaluran bansos baru a ncme amp t a bansos digunakan alat politik baru a ncme amp t a presiden netral baru a ncme amp t a presiden menteri menteri pihak koalisi baru a ncme amp t a bawaslu kp profesional baru a ncme amp t a ugaan pelanggaran kp baru a ncme amp t a hubungan putusan mahkamah konstitusi pelanggaran kp baru a ncme amp t a ketua kp mendapat peringatan keras berkali kali baru a ncme amp t a kontroversi putusan mahkamah konstitusi baru a ncme amp t a closing kesimpulan ketiga ahli hukum tata negara"
"mantap;mantap;mantap;mantap"
"hei bung masyarakat indonesia sebagian besar itu memang menyuarakan ke sedangkan sebagian kecil masyarakat indonesia menyuarakan buat anda br lu juga buat film hnya sepihak dan niatan memang buat menjatuhkan pemerintahan presiden jokowi dan jajarannya munafik abis lu lu kira kebenaran itu ada pada lu br sebangsat bangsatnya gue tetap ingat Tuhan sebab KEBENARAN yg real itu ada pd THAN bukan lu br br nah lu kira film ini bisa menyadarkan masyarakat yg seharusnya sadar itu yg pilih aja mau maunya dibodohi film kek gini pinter boleh goblok jangan br lu ngomong curang semua paslon itu curang bung lu yg katanya pinter bikin ini film masa gak ngerti arti MANIPLASI KECRANGAN br makannya pinter boleh goblok jangan br fitnah lewat film kek gini memang luar biasa dosanya br Bukti yang katanya akurat dan valid aja belom bisa diloloskan dalam persidangan makanya manipulasi kecurangan itu ada pada kalian yg mau menjatuhkan pemerintahan presiden jokowi goblok kok dipake buat nyerang orang welas asih seperti jokowi cuma kelompok lu aja yg menentang pemerintahan lu kira presiden jokowi gk punya Tuhan Makanya pinter boleh goblok jangan br THAN ALLAH SWT YANG MAHA AIL SEAIL AILNYA YANG MAHA KASA LANGIT AN BMI YANG MAHA AHSYAT menolong orang yg kalian bilang tak adillah plonga plongolah curanglah cebonglah bodohlah PKI lah dan lain lain br kalian itu yg seharusnya sadar sesadar sadarnya justru film begini yg sebagian masyarakat yg tadinya di justru beralih anggap saja paslon br br kalian mau bicara nurani serahkan pada masyarakat aja yg pilih jagoan masing masing br ada masyarakat sebagian BESAR dan ada masyarakat sebagian kecil;hei bung masyarakat indonesia sebagian besar itu memang menyuarakan ke sedangkan sebagian kecil masyarakat indonesia menyuarakan buat anda br lu juga buat film hnya sepihak dan niatan memang buat menjatuhkan pemerintahan presiden jokowi dan jajarannya munafik abis lu lu kira kebenaran itu ada pada lu br sebangsat bangsatnya gue tetap ingat tuhan sebab kebenaran yg real itu ada pd than bukan lu br br nah lu kira film ini bisa menyadarkan masyarakat yg seharusnya sadar itu yg pilih aja mau maunya dibodohi film kek gini pinter boleh goblok jangan br lu ngomong curang semua paslon itu curang bung lu yg katanya pinter bikin ini film masa gak ngerti arti maniplasi kecrangan br makannya pinter boleh goblok jangan br fitnah lewat film kek gini memang luar biasa dosanya br bukti yang katanya akurat dan valid aja belom bisa diloloskan dalam persidangan makanya manipulasi kecurangan itu ada pada kalian yg mau menjatuhkan pemerintahan presiden jokowi goblok kok dipake buat nyerang orang welas asih seperti jokowi cuma kelompok lu aja yg menentang pemerintahan lu kira presiden jokowi gk punya tuhan makanya pinter boleh goblok jangan br than allah swt yang maha ail seail ailnya yang maha kasa langit an bmi yang maha ahsyat menolong orang yg kalian bilang tak adillah plonga plongolah curanglah cebonglah bodohlah pki lah dan lain lain br kalian itu yg seharusnya sadar sesadar sadarnya justru film begini yg sebagian masyarakat yg tadinya di justru beralih anggap saja paslon br br kalian mau bicara nurani serahkan pada masyarakat aja yg pilih jagoan masing masing br ada masyarakat sebagian besar dan ada masyarakat sebagian kecil;hei bung masyarakat indonesia sebagian besar itu memang menyuarakan ke sedangkan sebagian kecil masyarakat indonesia menyuarakan buat anda baru lu juga buat film hanya sepihak dan niatan memang buat menjatuhkan pemerintahan presiden jokowi dan jajarannya munafik habis lu lu kira kebenaran itu ada pada lu baru sebangsat bangsatnya saya tetap ingat tuhan sebab kebenaran yang real itu ada pada than bukan lu baru baru nah lu kira film ini bisa menyadarkan masyarakat yang seharusnya sadar itu yang pilih saja mau maunya dibodohi film seperti begini pinter boleh goblok jangan baru lu bicara curang semua paslon itu curang bung lu yang katanya pinter bikin ini film masa tidak mengerti arti maniplasi kecrangan baru makannya pinter boleh goblok jangan baru fitnah lewat film seperti begini memang luar biasa dosanya baru bukti yang katanya akurat dan valid saja belum bisa diloloskan dalam persidangan makanya manipulasi kecurangan itu ada pada kalian yang mau menjatuhkan pemerintahan presiden jokowi goblok kok di pakai buat nyerang orang welas asih seperti jokowi cuma kelompok lu saja yang menentang pemerintahan lu kira presiden jokowi tidak punya tuhan makanya pinter boleh goblok jangan baru than allah swt yang maha ail seail ailnya yang maha kasa langit an bmi yang maha ahsyat menolong orang yang kalian bilang tidak adillah plonga plongolah curanglah cebonglah bodohlah pki lah dan lain lain baru kalian itu yang seharusnya sadar sesadar sadarnya justru film begini yang sebagian masyarakat yang tadinya di justru beralih anggap saja paslon baru baru kalian mau bicara nurani serahkan pada masyarakat saja yang pilih jagoan masing masing baru ada masyarakat sebagian besar dan ada masyarakat sebagian kecil;hei bung masyarakat indonesia sebagian besar memang menyuarakan sedangkan sebagian kecil masyarakat indonesia menyuarakan buat baru lu buat film sepihak niatan memang buat menjatuhkan pemerintahan presiden jokowi jajarannya munafik habis lu lu kira kebenaran lu baru sebangsat bangsatnya tetap ingat tuhan kebenaran real ada than bukan lu baru baru nah lu kira film menyadarkan masyarakat sadar pilih mau maunya dibodohi film begini pinter goblok jangan baru lu bicara curang semua paslon curang bung lu katanya pinter bikin film masa mengerti arti maniplasi kecrangan baru makannya pinter goblok jangan baru fitnah lewat film begini memang luar biasa dosanya baru bukti katanya akurat valid belum bisa diloloskan persidangan makanya manipulasi kecurangan ada kalian mau menjatuhkan pemerintahan presiden jokowi goblok kok pakai buat nyerang orang welas asih jokowi cuma kelompok lu menentang pemerintahan lu kira presiden jokowi punya tuhan makanya pinter goblok jangan baru than allah swt maha ail seail ailnya maha kasa langit an bmi maha ahsyat menolong orang kalian bilang adillah plonga plongolah curanglah cebonglah bodohlah pki lah lain baru kalian yang seharusnya sadar sesadar sadarnya justru film begini yang sebagian masyarakat yang tadinya justru beralih anggap paslon baru baru kalian mau bicara nurani serahkan masyarakat yang pilih jagoan masing masing baru ada masyarakat sebagian besar ada masyarakat sebagian kecil"
"i tunggu part II nya pasca pemilu rekap suara deklarasi awal pengangkatan menteri hak angket waah banyak deh ayo bang observasi dulu biar J dokumen untuk anak cucu kita nanti;i tunggu part ii nya pasca pemilu rekap suara deklarasi awal pengangkatan menteri hak angket waah banyak deh ayo bang observasi dulu biar j dokumen untuk anak cucu kita nanti;i tunggu part ii nya pasca pemilu rekap suara deklarasi awal pengangkatan menteri hak angket waah banyak deh ayo bang observasi dahulu biar j dokumen untuk anak cucu kita nanti;i tunggu part ii nya pasca pemilu rekap suara deklarasi awal pengangkatan menteri hak angket waah banyak deh ayo bang observasi biar j dokumen anak cucu nanti"
"cemen kritikan gue dihapus cemenn;cemen kritikan gue dihapus cemenn;cemen kritikan saya dihapus cemenn;cemen kritikan dihapus cemenn"
"ini film dg actor dan scenario terburuk br niat mau nambah suara malah anjlok di bawah saja;ini film dg actor dan scenario terburuk br niat mau nambah suara malah anjlok di bawah saja;ini film dengan actor dan scenario terburuk baru niat mau nambah suara bahkan anjlok di bawah saja;film actor scenario terburuk baru niat mau nambah suara bahkan anjlok bawah"
"Makamah international membatalkan Prabowo Gibran president MANTAP;makamah international membatalkan prabowo gibran president mantap;makamah international membatalkan prabowo gibran president mantap;makamah international membatalkan prabowo gibran president mantap"
"Kalau indo perang saudara br Kabur ke mana br Australia;kalau indo perang saudara br kabur ke mana br australia;kalau indo perang saudara baru kabur ke mana baru australia;kalau indo perang saudara baru kabur mana baru australia"
"Film ini yg buat suara ganjar mahfud jeblok X br Nyuruh dosen gaji MR bikin film propaganda itu kesalahan fatal;film ini yg buat suara ganjar mahfud jeblok x br nyuruh dosen gaji mr bikin film propaganda itu kesalahan fatal;film ini yang buat suara ganjar mahfud jeblok x baru nyuruh dosen gaji mr bikin film propaganda itu kesalahan fatal;film yang buat suara ganjar mahfud jeblok x baru nyuruh dosen gaji mr bikin film propaganda kesalahan fatal"
"Siapapun presidennya yg penting dapat bansos;siapapun presidennya yg penting dapat bansos;siapapun presidennya yang penting dapat bansos;siapapun presidennya penting bansos"
"Menonton ulang video ini makin sadar sy lebih pintar;menonton ulang video ini makin sadar sy lebih pintar;menonton ulang video ini makin sadar saya lebih pintar;menonton ulang video makin sadar lebih pintar"
"jam yang sia sia ga ngerubah hasil;jam yang sia sia ga ngerubah hasil;jam yang sia sia tidak ngerubah hasil;jam sia sia ngerubah hasil"
"Politik paling bego;politik paling bego;politik paling bodoh;politik paling bodoh"
"Hanya demi melanggengkan kekuasaan;hanya demi melanggengkan kekuasaan;hanya demi melanggengkan kekuasaan;demi melanggengkan kekuasaan"
"Pemilu paling brutal di abad ini;pemilu paling brutal di abad ini;pemilu paling brutal di abad ini;pemilu paling brutal abad"
"iq otak udang tak bisa cerna isi video ini;iq otak udang tak bisa cerna isi video ini;iq otak udang tidak bisa cerna isi video ini;iq otak udang bisa cerna isi video"
"Katanya IQ tinggi masa gak menghargai suara rakyat itulah demokrasi jangan lu persekusi online kocak;katanya iq tinggi masa gak menghargai suara rakyat itulah demokrasi jangan lu persekusi online kocak;katanya iq tinggi masa tidak menghargai suara rakyat itulah demokrasi jangan lu persekusi daring kocak;katanya iq tinggi masa menghargai suara rakyat demokrasi jangan lu persekusi daring kocak"
"suritauladan betul kata socrates demokrasi bisa jadi dipenuhi orang bodoh yang memilih suara tanpa mengetahui lebih jauh kebutuhan negerinya;suritauladan betul kata socrates demokrasi bisa jadi dipenuhi orang bodoh yang memilih suara tanpa mengetahui lebih jauh kebutuhan negerinya;suritauladan betul kata socrates demokrasi bisa jadi dipenuhi orang bodoh yang memilih suara tanpa mengetahui lebih jauh kebutuhan negerinya;suritauladan betul kata socrates demokrasi jadi dipenuhi orang bodoh memilih suara mengetahui lebih jauh kebutuhan negerinya"
"suritauladan kalo masih belum paham sih udh ga tau lagi tuh iq nya berapa bro bro;suritauladan kalo masih belum paham sih udh ga tau lagi tuh iq nya berapa bro bro;suritauladan kalau masih belum paham sih sudah tidak tahu lagi tuh iq nya berapa bro bro;suritauladan kalau belum paham sih tidak tahu tuh iq nya berapa bro bro"
"Ngaku IQ tinggi tapi cari duit susah mau cari jabatan juga susah br Gw yakin ortu lo juga ga mau ngakuin kepinteran lo X;ngaku iq tinggi tapi cari duit susah mau cari jabatan juga susah br gw yakin ortu lo juga ga mau ngakuin kepinteran lo x;ngaku iq tinggi tapi cari uang susah mau cari jabatan juga susah baru saya yakin ortu lo juga tidak mau ngakuin kepinteran lo x;ngaku iq tinggi cari uang susah mau cari jabatan susah baru yakin ortu lo tidak mau ngakuin kepinteran lo x"
"ntung masih ada videonya dan gak dihapus;ntung masih ada videonya dan gak dihapus;ntung masih ada videonya dan tidak dihapus;ntung ada videonya tidak dihapus"
"saya datang terlambat kesini andai dulu nonton video ini;saya datang terlambat kesini andai dulu nonton video ini;saya datang terlambat kesini andai dahulu nonton video ini;datang terlambat kesini andai nonton video"
"Jangan memakan hal yg manis apalagi urusan presiden;jangan memakan hal yg manis apalagi urusan presiden;jangan memakan hal yang manis apalagi urusan presiden;jangan memakan yang manis urusan presiden"
"Rewatch;rewatch;rewatch;rewatch"
"MA NGAKAK IKASIH NIH VIIO BAT PILIH YANG CERAS MALAH PILIH SEMANGAT IRTY VOTE SEKARANG SAH TERBKTI TNGG SAMPAI TAHN BERIKTNYA AN SETERSNYA INONESIA BAKALAN SSAH;ma ngakak ikasih nih viio bat pilih yang ceras malah pilih semangat irty vote sekarang sah terbkti tngg sampai tahn beriktnya an setersnya inonesia bakalan ssah;sama ngakak ikasih nih viio bat pilih yang ceras bahkan pilih semangat irty vote sekarang sah terbkti tngg sampai tahn beriktnya an setersnya inonesia bakalan ssah;sama ngakak ikasih nih viio bat pilih ceras bahkan pilih semangat irty vote sekarang sah terbkti tngg tahn beriktnya an setersnya inonesia bakalan ssah"
"Menang merayakan br Kalah menjelaskan;menang merayakan br kalah menjelaskan;menang merayakan baru kalah menjelaskan;menang merayakan baru kalah menjelaskan"
"Menang mah jelasin jg lah bukan rayakan joget gajelas;menang mah jelasin jg lah bukan rayakan joget gajelas;menang mah jelasin juga lah bukan rayakan joget tidak jelas;menang mah jelasin lah bukan rayakan joget jelas"
"Lu gak nonton ya speechnya Paslon nomor setelah kepilih;lu gak nonton ya speechnya paslon nomor setelah kepilih;lu tidak nonton ya speechnya paslon nomor setelah kepilih;lu nonton speechnya paslon nomor kepilih"
"? ahmadimannudin udah menang ngapain dijelasin;? ahmadimannudin udah menang ngapain dijelasin;? ahmadimannudin sudah menang buat apa dijelasin;? ahmadimannudin menang buat apa dijelasin"
"Miris banget ngeliat negara yang kaya akan sumber daya alam nya tapi pemerintah nya goblok bukan maen;miris banget ngeliat negara yang kaya akan sumber daya alam nya tapi pemerintah nya goblok bukan maen;miris banget ngeliat negara yang kayak akan sumber daya alam nya tapi pemerintah nya goblok bukan maen;miris banget ngeliat negara kayak sumber daya alam nya pemerintah nya goblok bukan maen"
"klo lo pinter lo yg jd presiden kocak br Paling juga ortu lo nyesel ngelahirin anak cuman jd beban X;klo lo pinter lo yg jd presiden kocak br paling juga ortu lo nyesel ngelahirin anak cuman jd beban x;kalau lo pinter lo yang jadi presiden kocak baru paling juga ortu lo menyesal ngelahirin anak cuman jadi beban x;kalau lo pinter lo jadi presiden kocak baru paling ortu lo menyesal ngelahirin anak cuman jadi beban x"
"daunbiru gua udah kerja dan gua bukan beban ortu gua juga gak nyesel lahirin gua buktinya gua masih hidup sampai sekarang lu aja yang kocak bego;daunbiru gua udah kerja dan gua bukan beban ortu gua juga gak nyesel lahirin gua buktinya gua masih hidup sampai sekarang lu aja yang kocak bego;daunbiru saya sudah kerja dan saya bukan beban ortu saya juga tidak menyesal lahirin saya buktinya saya masih hidup sampai sekarang lu saja yang kocak bodoh;daunbiru sudah kerja bukan beban ortu juga menyesal lahirin buktinya saya masih hidup sekarang lu yang kocak bodoh"
"Ngaku ngga ada penulis bang tere liye yg terlibat di produksi film pendek ini Buku TBJP itu kisah nyata kan sebenernya Pdhl baru baca buku bbrp halaman doang ini ya Allah tp udah mangkel;ngaku ngga ada penulis bang tere liye yg terlibat di produksi film pendek ini buku tbjp itu kisah nyata kan sebenernya pdhl baru baca buku bbrp halaman doang ini ya allah tp udah mangkel;ngaku tidak ada penulis bang tere liye yang terlibat di produksi film pendek ini buku tbjp itu kisah nyata akan sebenarnya padahal baru baca buku beberapa halaman saja ini ya allah tapi sudah mangkel;ngaku ada penulis bang tere liye terlibat produksi film pendek buku tbjp kisah nyata sebenarnya padahal baru baca buku beberapa halaman ini allah sudah mangkel"
"ga mempan dek;ga mempan dek;tidak mempan dek;mempan dek"
"dan sekarang sudah mulai terasa KT naik pegasus alat penyadap dah masuk dan kita liat cawe quot keluarga yang mulia jokowi untuk pilgub di negeri nya paman usman Wakanda;dan sekarang sudah mulai terasa kt naik pegasus alat penyadap dah masuk dan kita liat cawe quot keluarga yang mulia jokowi untuk pilgub di negeri nya paman usman wakanda;dan sekarang sudah mulai terasa kata naik pegasus alat penyadap sudah masuk dan kita lihat cawe quot keluarga yang mulia jokowi untuk pilgub di negeri nya paman usman wakanda;sekarang mulai terasa kata naik pegasus alat penyadap masuk kita lihat cawe quot keluarga mulia jokowi pilgub negeri nya paman usman wakanda"
"Biarkan filem ini menjadi sejarah tuntunan atas kebenaran itu sendiri memanusiakan manusia seutuhnya tidak membela pihak mana pun;biarkan filem ini menjadi sejarah tuntunan atas kebenaran itu sendiri memanusiakan manusia seutuhnya tidak membela pihak mana pun;biarkan filem ini menjadi sejarah tuntunan atas kebenaran itu sendiri memanusiakan manusia seutuhnya tidak membela pihak mana pun;biarkan filem menjadi sejarah tuntunan atas kebenaran sendiri memanusiakan manusia seutuhnya membela pihak mana"
"ah kocak;ah kocak;ah kocak;ah kocak"
"Terimakasih;terimakasih;terima kasih;terima kasih"
"Film edukasi yang keren Mencerdaskan bangsa tentang kebusukan pemimpin negara saat ini Tapi kita bisa apa sekarang Tinggal tunggu pengadilan akhirat untuk pemimpin dzolim;film edukasi yang keren mencerdaskan bangsa tentang kebusukan pemimpin negara saat ini tapi kita bisa apa sekarang tinggal tunggu pengadilan akhirat untuk pemimpin dzolim;film edukasi yang keren mencerdaskan bangsa tentang kebusukan pemimpin negara saat ini tapi kita bisa apa sekarang tinggal tunggu pengadilan akhirat untuk pemimpin dzolim;film edukasi keren mencerdaskan bangsa kebusukan pemimpin negara ini kita apa sekarang tinggal tunggu pengadilan akhirat pemimpin dzolim"
"nanti kedepannya pasti yg jdi presiden dan wakil yg ada keturunan ama presiden sebelumnya buat apa demokrasi klo dari awal sudah di atur sekalian aja hpus demokrasi jdi negara raja;nanti kedepannya pasti yg jdi presiden dan wakil yg ada keturunan ama presiden sebelumnya buat apa demokrasi klo dari awal sudah di atur sekalian aja hpus demokrasi jdi negara raja;nanti kedepannya pasti yang jadi presiden dan wakil yang ada keturunan sama presiden sebelumnya buat apa demokrasi kalau dari awal sudah di atur sekalian saja hpus demokrasi jadi negara raja;kedepannya jadi presiden wakil yang ada keturunan sama presiden sebelumnya buat apa demokrasi kalau awal di atur sekalian hpus demokrasi jadi negara raja"
"wkwkwkw anu kepriwe jane ribet nemen;wkwkwkw anu kepriwe jane ribet nemen;wkwkwkw anu kepriwe jane rumit nemen;wkwkwkw kepriwe jane rumit nemen"
"FILM IRTY VOTE ISEBARKAN PAA MASA TENANG JELANG HARI quot H quot PENCOBLOSAN IKEMAS ENGAN HIMBAAN AGAR MELAKKAN PENGHKMAN YAA YA INILAH PROPAGANA LICIK BERKEOK EKASI TAPI JTA LEBIH RAKYAT INONESIA TELAH MENJAWABNYA ENGAN MENCOBLOS PRABOWO I TPS TPS PAA FEBRARI NGGL NTK PRABOWO GAGAL TOTAL NTK PROPAGANA LICIK;film irty vote isebarkan paa masa tenang jelang hari quot h quot pencoblosan ikemas engan himbaan agar melakkan penghkman yaa ya inilah propagana licik berkeok ekasi tapi jta lebih rakyat inonesia telah menjawabnya engan mencoblos prabowo i tps tps paa febrari nggl ntk prabowo gagal total ntk propagana licik;film irty vote isebarkan paa masa tenang jelang hari quot h quot pencoblosan ikemas engan himbaan agar melakkan penghkman ya ya inilah propagana licik berkeok ekasi tapi jta lebih rakyat inonesia telah menjawabnya engan mencoblos prabowo i tps tps paa febrari nggl ntk prabowo gagal total ntk propagana licik;film irty vote isebarkan paa masa tenang jelang hari quot h quot pencoblosan ikemas engan himbaan melakkan penghkman ya inilah propagana licik berkeok ekasi jta lebih rakyat inonesia menjawabnya engan mencoblos prabowo i tps tps paa febrari nggl ntk prabowo gagal total ntk propagana licik"
"piye kabare saiki rek;piye kabare saiki rek;piye kabare saiki rek;piye kabare saiki rek"
"JTA LEBIH RAKYAT INONESIA GAGAL ALAM MEMILIH PEMIMPIN;jta lebih rakyat inonesia gagal alam memilih pemimpin;jta lebih rakyat inonesia gagal alam memilih pemimpin;jta lebih rakyat inonesia gagal alam memilih pemimpin"
"Login;login;login;login"
